paper_id,title,authors,published,updated,summary,categories,primary_category,pdf_url,entry_id,comment,journal_ref,doi,search_keyword,pdf_file
2605.15201v1,Mixed-State Long-Range Entanglement from Dimensional Constraints,"Leonardo A. Lessa, Tsung-Cheng Lu",2026-05-14 17:59:59+00:00,2026-05-14 17:59:59+00:00,"We present a new mechanism for long-range entanglement (LRE) in strongly symmetric many-body mixed states that does not rely on symmetry anomalies or long-range correlations. Our primary example is the maximally mixed state in the translation-invariant subspace on a one-dimensional ring. This state is LRE because translationally symmetric short-range entangled states span a subspace whose dimension grows only polynomially with system size, whereas the full translation-invariant subspace grows exponentially. We further discuss certain unconventional properties of this state, including logarithmically growing conditional mutual information, strong-to-weak spontaneous symmetry-breaking, and Rényi-index-dependent operator-space entanglement. We also construct a geometrically non-local Lindbladian to stabilize this state as the steady state. Our results identify dimensional mismatch as a novel route to LRE that is intrinsic to many-body mixed states.","quant-ph, cond-mat.stat-mech, cond-mat.str-el",quant-ph,https://arxiv.org/pdf/2605.15201v1,http://arxiv.org/abs/2605.15201v1,"27 pages, 2+8 figures",,,quantum machine learning,2605.15201v1.pdf
2605.15200v1,Translation symmetry-enforced long-range entanglement in mixed states,"Ryan Thorngren, Lei Gioia, Carolyn Zhang",2026-05-14 17:59:57+00:00,2026-05-14 17:59:57+00:00,"We show by a counting argument that even though translation symmetry admits symmetric short-range entangled (SRE) eigenstates, there are not enough such SRE eigenstates to span the zero momentum sector. This means that the fixed point strong-to-weak spontaneous symmetry breaking state of translation symmetry is long-range entangled: it cannot be written as a mixture of SRE states. This is a subtle form of long-range entanglement in mixed states that cannot be detected by long-range connected correlation functions.","quant-ph, cond-mat.mes-hall, cond-mat.str-el, math-ph",quant-ph,https://arxiv.org/pdf/2605.15200v1,http://arxiv.org/abs/2605.15200v1,"5+4 pages, 3 figures",,,quantum machine learning,2605.15200v1.pdf
2605.15196v1,RefDecoder: Enhancing Visual Generation with Conditional Video Decoding,"Xiang Fan, Yuheng Wang, Bohan Fang, Zhongzheng Ren, Ranjay Krishna",2026-05-14 17:59:52+00:00,2026-05-14 17:59:52+00:00,"Video generation powers a vast array of downstream applications. However, while the de facto standard, i.e., latent diffusion models, typically employ heavily conditioned denoising networks, their decoders often remain unconditional. We observe that this architectural asymmetry leads to significant loss of detail and inconsistency relative to the input image. To address this, we argue that the decoder requires equal conditioning to preserve structural integrity. We introduce RefDecoder, a reference-conditioned video VAE decoder by injecting high-fidelity reference image signal directly into the decoding process via reference attention. Specifically, a lightweight image encoder maps the reference frame into the detail-rich high-dimensional tokens, which are co-processed with the denoised video latent tokens at each decoder up-sampling stage. We demonstrate consistent improvements across several distinct decoder backbones (e.g., Wan 2.1 and VideoVAE+), achieving up to +2.1dB PSNR over the unconditional baselines on the Inter4K, WebVid, and Large Motion reconstruction benchmarks. Notably, RefDecoder can be directly swapped into existing video generation systems without additional fine-tuning, and we report across-the-board improvements in subject consistency, background consistency, and overall quality scores on the VBench I2V benchmark. Beyond I2V, RefDecoder generalizes well to a wide range of visual generation tasks such as style transfer and video editing refinement.","cs.CV, cs.LG",cs.CV,https://arxiv.org/pdf/2605.15196v1,http://arxiv.org/abs/2605.15196v1,,,,quantum machine learning,2605.15196v1.pdf
2605.15195v1,VGGT-$Ω$,"Jianyuan Wang, Minghao Chen, Shangzhan Zhang, Nikita Karaev, Johannes Schönberger, Patrick Labatut, Piotr Bojanowski, David Novotny, Andrea Vedaldi, Christian Rupprecht",2026-05-14 17:59:51+00:00,2026-05-14 17:59:51+00:00,"Recent feed-forward reconstruction models, such as VGGT, have proven competitive with traditional optimization-based reconstructors while also providing geometry-aware features useful for other tasks. Here, we show that the quality of these models scales predictably with model and data size. We do so by introducing VGGT-$Ω$, which substantially improves reconstruction accuracy, efficiency, and capabilities for both static and dynamic scenes. To enable training this model at an unprecedented scale, we introduce architectural changes that improve training efficiency, a high-quality data annotation pipeline that supports dynamic scenes, and a self-supervised learning protocol. We simplify VGGT's architecture by using a single dense prediction head with multi-task supervision and removing the expensive high-resolution convolutional layers. We also use registers to aggregate scene information into a compact representation and introduce register attention, which restricts inter-frame information exchange to these registers, in part replacing global attention. In this way, during training, VGGT-$Ω$ uses only about 30% of the GPU memory of its predecessor, allowing us to train with 15x more supervised data than prior work and to leverage vast amounts of unlabeled video data. VGGT-$Ω$ achieves strong results for reconstruction of static and dynamic scenes across multiple benchmarks, for example, improving over the previous best camera estimation accuracy on Sintel by 77%. We also show that the learned registers can improve vision-language-action models and support alignment with language, suggesting that reconstruction can be a powerful and scalable proxy task for spatial understanding. Project Page: http://vggt-omega.github.io/",cs.CV,cs.CV,https://arxiv.org/pdf/2605.15195v1,http://arxiv.org/abs/2605.15195v1,CVPR 2026 (Oral),,,quantum machine learning,2605.15195v1.pdf
2605.15194v1,Non-Invertible Symmetries on Tensor-Product Hilbert Spaces and Quantum Cellular Automata,"Rui Wen, Kansei Inamura, Sakura Schafer-Nameki",2026-05-14 17:59:45+00:00,2026-05-14 17:59:45+00:00,"We investigate realizations of (1+1)-dimensional fusion category symmetries on tensor-product Hilbert spaces, allowing for mixing with quantum cellular automata (QCAs). It was argued recently that any such realizable symmetry must be weakly integral. We develop a systematic analysis of QCA-refined realizations of fusion categories and prove two statements. First, we show that, under certain physical assumptions on defects, any QCA-refined realization has QCA and symmetry-operator indices determined by the categorical data, up to the freedom of redefining the symmetry operators. Second, we construct a lattice model that provides a QCA-refined realization for any weakly integral fusion category symmetry on a tensor product Hilbert space. We also compute indices of the QCAs in our lattice model and show agreement with the first result. As an application of the general construction, we give an explicit QCA-refined realization of general Tambara-Yamagami categorical symmetries.","cond-mat.str-el, hep-th, math.CT, quant-ph",cond-mat.str-el,https://arxiv.org/pdf/2605.15194v1,http://arxiv.org/abs/2605.15194v1,40 pages,,,quantum machine learning,2605.15194v1.pdf
2605.15190v1,RAVEN: Real-time Autoregressive Video Extrapolation with Consistency-model GRPO,"Yanzuo Lu, Ronglai Zuo, Jiankang Deng",2026-05-14 17:59:30+00:00,2026-05-14 17:59:30+00:00,"Causal autoregressive video diffusion models support real-time streaming generation by extrapolating future chunks from previously generated content. Distilling such generators from high-fidelity bidirectional teachers yields competitive few-step models, yet a persistent gap between the history distributions encountered during training and those arising at inference constrains generation quality over long horizons. We introduce the Real-time Autoregressive Video Extrapolation Network (RAVEN), a training-time test framework that repacks each self rollout into an interleaved sequence of clean historical endpoints and noisy denoising states. This formulation aligns training attention with inference-time extrapolation and allows downstream chunk losses to supervise the history representations on which future predictions depend. We further propose Consistency-model Group Relative Policy Optimization (CM-GRPO), which reformulates a consistency sampling step as a conditional Gaussian transition and applies online Reinforcement Learning (RL) directly to this kernel, avoiding the Euler-Maruyama auxiliary process adopted in prior flow-model RL formulations. Experiments demonstrate that RAVEN surpasses recent causal video distillation baselines across quality, semantic, and dynamic degree evaluations, and that CM-GRPO provides further gains when combined with RAVEN.",cs.CV,cs.CV,https://arxiv.org/pdf/2605.15190v1,http://arxiv.org/abs/2605.15190v1,Project Page: https://yanzuo.lu/raven,,,quantum machine learning,2605.15190v1.pdf
2605.15188v1,FutureSim: Replaying World Events to Evaluate Adaptive Agents,"Shashwat Goel, Nikhil Chandak, Arvindh Arun, Ameya Prabhu, Steffen Staab, Moritz Hardt, Maksym Andriushchenko, Jonas Geiping",2026-05-14 17:59:28+00:00,2026-05-14 17:59:28+00:00,"AI agents are being increasingly deployed in dynamic, open-ended environments that require adapting to new information as it arrives. To efficiently measure this capability for realistic use-cases, we propose building grounded simulations that replay real-world events in the order they occurred. We build FutureSim, where agents forecast world events beyond their knowledge cutoff while interacting with a chronological replay of the world: real news articles arriving and questions resolving over the simulated period. We evaluate frontier agents in their native harness, testing their ability to predict world events over a three-month period from January to March 2026. FutureSim reveals a clear separation in their capabilities, with the best agent's accuracy being 25%, and many having worse Brier skill score than making no prediction at all. Through careful ablations, we show how FutureSim offers a realistic setting to study emerging research directions like long-horizon test-time adaptation, search, memory, and reasoning about uncertainty. Overall, we hope our benchmark design paves the way to measure AI progress on open-ended adaptation spanning long time-horizons in the real world.","cs.LG, cs.AI, cs.CL",cs.LG,https://arxiv.org/pdf/2605.15188v1,http://arxiv.org/abs/2605.15188v1,"31 pages, 10 main",,,quantum machine learning,2605.15188v1.pdf
2605.15187v1,Articraft: An Agentic System for Scalable Articulated 3D Asset Generation,"Matt Zhou, Ruining Li, Xiaoyang Lyu, Zhaomou Song, Zhening Huang, Chuanxia Zheng, Christian Rupprecht, Andrea Vedaldi, Shangzhe Wu",2026-05-14 17:59:18+00:00,2026-05-14 17:59:18+00:00,"A bottleneck in learning to understand articulated 3D objects is the lack of large and diverse datasets. In this paper, we propose to leverage large language models (LLMs) to close this gap and generate articulated assets at scale. We reduce the problem of generating an articulated 3D asset to that of writing a program that builds it. We then introduce a new agentic system, Articraft, that writes such programs automatically. We design a programmatic interface and harness to help the LLM do so effectively. The LLM writes code against a domain-specific SDK for defining parts, composing geometry, specifying joints, and writing tests to validate the resulting assets. The harness exposes a restricted workspace and interface to the LLM, validates the resulting assets, and returns structured feedback. In this way, the LLM is not distracted by details such as authoring a URDF file or managing a complex software environment. We show that this produces higher-quality assets than both state-of-the-art articulated-asset generators and general-purpose coding agents. Using Articraft, we build Articraft-10K, a curated dataset of over 10K articulated assets spanning 245 categories, and show its utility both for training models of articulated assets and in downstream applications such as robotics simulation and virtual reality.","cs.CV, cs.GR, cs.RO",cs.CV,https://arxiv.org/pdf/2605.15187v1,http://arxiv.org/abs/2605.15187v1,Project page: https://articraft3d.github.io/,,,quantum machine learning,2605.15187v1.pdf
2605.15185v1,Quantitative Video World Model Evaluation for Geometric-Consistency,"Jiaxin Wu, Yihao Pi, Yinling Zhang, Yuheng Li, Xueyan Zou",2026-05-14 17:59:04+00:00,2026-05-14 17:59:04+00:00,"Generative video models are increasingly studied as implicit world models, yet evaluating whether they produce physically plausible 3D structure and motion remains challenging. Most existing video evaluation pipelines rely heavily on human judgment or learned graders, which can be subjective and weakly diagnostic for geometric failures. We introduce PDI-Bench (Perspective Distortion Index), a quantitative framework for auditing geometric coherence in generated videos. Given a generated clip, we obtain object-centric observations via segmentation and point tracking (e.g., SAM 2, MegaSaM, and CoTracker3), lift them to 3D world-space coordinates via monocular reconstruction, and compute a set of projective-geometry residuals capturing three failure dimensions: scale-depth alignment, 3D motion consistency, and 3D structural rigidity. To support systematic evaluation, we build PDI-Dataset, covering diverse scenarios designed to stress these geometric constraints. Across state-of-the-art video generators, PDI reveals consistent geometry-specific failure modes that are not captured by common perceptual metrics, and provides a diagnostic signal for progress toward physically grounded video generation and physical world model. Our code and dataset can be found at https://pdi-bench.github.io/.","cs.CV, cs.AI",cs.CV,https://arxiv.org/pdf/2605.15185v1,http://arxiv.org/abs/2605.15185v1,"12 pages, 5 figures. Project page : https://pdi-bench.github.io/",,,quantum machine learning,2605.15185v1.pdf
2605.15183v1,When Are Two Networks the Same? Tensor Similarity for Mechanistic Interpretability,"ML Nissen Gonzalez, Melwina Albuquerque, Laurence Wroe, Jacob Meyer Cohen, Logan Riggs Smith, Thomas Dooms",2026-05-14 17:58:27+00:00,2026-05-14 17:58:27+00:00,"Mechanistic interpretability aims to break models into meaningful parts; verifying that two such parts implement the same computation is a prerequisite. Existing similarity measures evaluate either empirical behaviour, leaving them blind to out-of-distribution mechanisms, or basis-dependent parameters, meaning they disregard weight-space symmetries. To address these issues for the class of tensor-based models, we introduce a weight-based metric, tensor similarity, that is invariant to such symmetries. This metric captures global functional equivalence and accounts for cross-layer mechanisms using an efficient recursive algorithm. Empirically, tensor similarity tracks functional training dynamics, such as grokking and backdoor insertion, with higher fidelity than existing metrics. This reduces measuring similarity and verifying faithfulness into a solved algebraic problem rather than one of empirical approximation.",cs.LG,cs.LG,https://arxiv.org/pdf/2605.15183v1,http://arxiv.org/abs/2605.15183v1,"22 pages, 8 figures. Code: https://github.com/tdooms/tensor-similarity",,,quantum machine learning,2605.15183v1.pdf
2605.15182v1,Warp-as-History: Generalizable Camera-Controlled Video Generation from One Training Video,"Yifan Wang, Tong He",2026-05-14 17:58:26+00:00,2026-05-14 17:58:26+00:00,"Camera-controlled video generation has made substantial progress, enabling generated videos to follow prescribed viewpoint trajectories. However, existing methods usually learn camera-specific conditioning through camera encoders, control branches, or attention and positional-encoding modifications, which often require post-training on large-scale camera-annotated videos. Training-free alternatives avoid such post-training, but often shift the cost to test-time optimization or extra denoising-time guidance. We propose Warp-as-History, a simple interface that turns camera-induced warps into camera-warped pseudo-history with target-frame positional alignment and visible-token selection. Given a target camera trajectory, we construct camera-warped pseudo-history from past observations and feed it through the model's visual-history pathway. Crucially, we align its positional encoding with the target frames being denoised and remove warped-history tokens without valid source observations. Without any training, architectural modification, or test-time optimization, this interface reveals a non-trivial zero-shot capability of a frozen video generation model to follow camera trajectories. Moreover, lightweight offline LoRA finetuning on only one camera-annotated video further improves this capability and generalizes to unseen videos, improving camera adherence, visual quality, and motion dynamics without test-time optimization or target-video adaptation. Extensive experiments on diverse datasets confirm the effectiveness of our method.",cs.CV,cs.CV,https://arxiv.org/pdf/2605.15182v1,http://arxiv.org/abs/2605.15182v1,Project page: https://yyfz.github.io/warp-as-history/,,,quantum machine learning,2605.15182v1.pdf
2605.15179v1,Eradicating Negative Transfer in Multi-Physics Foundation Models via Sparse Mixture-of-Experts Routing,"Ellwil Sharma, Arastu Sharma",2026-05-14 17:58:15+00:00,2026-05-14 17:58:15+00:00,"Scaling Scientific Machine Learning (SciML) toward universal foundation models is bottlenecked by negative transfer: the simultaneous co-training of disparate partial differential equation (PDE) regimes can induce gradient conflict, unstable optimization, and plasticity loss in dense neural operators. In particular, broadband open-channel fluid dynamics and boundary-dominated porous media flows impose incompatible spectral and geometric demands on a single dense parameter path. We introduce Shodh-MoE, a sparse-activated latent transformer architecture for multi-physics transport. Shodh-MoE operates on compressed 16^3 physical latents produced by a physics-informed autoencoder with an intra-tokenizer Helmholtz-style velocity parameterization, restricting decoded states to divergence-free velocity manifolds. The model guarantees exact mass conservation, achieving a physically verifiable velocity divergence of ~2.8 x 10^-10 (evaluated post-hoc in FP64) on 128^3 grids. A Top-1 soft-semantic router dynamically assigns localized latent patches to expert subnetworks, enabling specialized parameter paths for distinct physical mechanisms while preserving shared experts for universal symmetries. In a 20,000-step distributed pretraining run over mixed three-dimensional physical tensors, routing telemetry shows autonomous domain bifurcation: held-out validation tokens from the open-channel domain route exclusively to Expert 0, while porous-media tokens route exclusively to Expert 1. The model converges simultaneously across both regimes, achieving latent validation MSEs of 2.46 x 10^-5 and 9.76 x 10^-6, and decoded physical MSEs of 2.48 x 10^-6 and 1.76 x 10^-6. These results support sparse expert routing as a practical architectural mechanism for mitigating multi-physics interference in universal neural operators.","cs.LG, cs.AI, physics.comp-ph",cs.LG,https://arxiv.org/pdf/2605.15179v1,http://arxiv.org/abs/2605.15179v1,"5 pages, 4 figures",,,quantum machine learning,2605.15179v1.pdf
2605.15175v1,Detecting the Axion-Photon Conversion Background,"Felix Weber, Vikram Ravi",2026-05-14 17:57:21+00:00,2026-05-14 17:57:21+00:00,"The potential to detect axion dark matter through astrophysical processes has shown high promise in recent years. We therefore expand on previous work studying the axion-to-photon conversion efficacy of neutron stars and the interstellar medium (ISM) in this endeavor, respectively. For neutron stars (NS), we examine the possibility of a background signal emanating from all NS magnetospheres in the galaxy. Using a heuristic Galactic model, we find a significant background signal emanating from such magnetospheres in the Milky Way. This signal, while weak in absolute power ($\gtrsim 1$ mJy sr$^{-1}$ from the Galactic Center, at 2 GHz), can be detected through new statistical techniques with current instrumentation like the Atacama Large Millimeter Array (ALMA) at high radio frequencies (200 - 950 GHz). These techniques make use of higher order statistics like spectrally-limited ($\sim 300$ km s$^{-1}$) increases in confusion noise levels and kurtoses of survey images, and also show promise for general population estimation techniques.
  For the ISM, we consider Primakoff processes between free electrons and axions, and derive typical signal strengths of $10^{-15}$ Jy sr$^{-1}$ $\cdot$ $m_a$/eV, with a local, cosmological upper bound of $10^{-8}$ Jy sr$^{-1}$ $\cdot$ $m_a$/eV. Hence, we find that any diffuse axion signal from the ISM and other, large-scale, astrophysical plasmas to be too weak to be detected with modern technologies. We therefore find that the best avenue towards detecting a potential quantum chromodynamics (QCD) axion dark-matter particle is through the radio imaging of large swaths of the Galactic Center and other regions where we expect large numbers of pulsars and neutron stars.",astro-ph.HE,astro-ph.HE,https://arxiv.org/pdf/2605.15175v1,http://arxiv.org/abs/2605.15175v1,Preprint; 16 pages and 10 figures,,,quantum machine learning,2605.15175v1.pdf
2605.15174v1,Universal quantum resource distillation via composite generalised quantum Stein's lemma,"Ludovico Lami, Bartosz Regula, Ryuji Takagi",2026-05-14 17:57:05+00:00,2026-05-14 17:57:05+00:00,"The performance of quantum resource manipulation protocols, including key examples such as distillation of quantum entanglement, is measured in terms of the rate at which desired target states can be produced from a given noisy state. However, to achieve optimal rates, known protocols require precise tailoring to the quantum state in question, demanding a perfect knowledge of the input and allowing no errors in its preparation. Here we show that distillation of quantum resources in the framework of resource non-generating operations can be performed universally: optimal rates of distillation can be achieved with no knowledge of the input state whatsoever, certifying the robustness of quantum resource distillation. The findings apply in particular to the purification of quantum entanglement under non-entangling maps, where the optimal rates are governed by the regularised relative entropy of entanglement. Our result relies on an extension of the generalised quantum Stein's lemma in quantum hypothesis testing to a composite setting where the null hypothesis is no longer a fixed quantum state, but is rather composed of i.i.d. copies of an unknown state. The solution of this asymptotic problem is made possible through new developments in one-shot quantum information and a refinement of the blurring technique from [Lami, arXiv:2408.06410].","quant-ph, cond-mat.stat-mech, cs.IT, math-ph",quant-ph,https://arxiv.org/pdf/2605.15174v1,http://arxiv.org/abs/2605.15174v1,8+12 pages,,,quantum machine learning,2605.15174v1.pdf
2605.15168v1,"Text Knows What, Tables Know When: Clinical Timeline Reconstruction via Retrieval-Augmented Multimodal Alignment","Sayantan Kumar, Shahriar Noroozizadeh, Juyong Kim, Jeremy C. Weiss",2026-05-14 17:55:27+00:00,2026-05-14 17:55:27+00:00,"Reconstructing precise clinical timelines is essential for modeling patient trajectories and forecasting risk in complex, heterogeneous conditions like sepsis. While unstructured clinical narratives offer semantically rich and contextually complete descriptions of a patient's course, they often lack temporal precision and contain ambiguous event timing. Conversely, structured electronic health record (EHR) data provides precise temporal anchors but misses a substantial portion of clinically meaningful events. We introduce a retrieval-augmented multimodal alignment framework that bridges this gap to improve the temporal precision of absolute clinical timelines extracted from text. Our approach formulates timeline reconstruction as a graph-based multistep process: it first extracts central anchor events from narratives to build an initial temporal scaffold, places non-central events relative to this backbone, and then calibrates the timeline using retrieved structured EHR rows as external temporal evidence. Evaluated using instruction-tuned large language models on the i2m4 benchmark spanning MIMIC-III and MIMIC-IV, our multimodal pipeline consistently improves absolute timestamp accuracy (AULTC) and improves temporal concordance across nearly all evaluated models over unimodal text-only reconstruction, without compromising event match rates. Furthermore, our empirical gap analysis reveals that 34.8% of text-derived events are entirely absent from tabular records, demonstrating that aligning these modalities can produce a more temporally faithful and clinically informative reconstruction of patient trajectories than either source alone.","cs.CL, cs.AI, cs.LG, stat.ML",cs.CL,https://arxiv.org/pdf/2605.15168v1,http://arxiv.org/abs/2605.15168v1,"Sayantan Kumar, Shahriar Noroozizadeh, Juyong Kim (authors contributed equally)",,,quantum machine learning,2605.15168v1.pdf
