paper_id,title,authors,published,updated,summary,categories,primary_category,pdf_url,entry_id,comment,journal_ref,doi,search_keyword,pdf_file
2605.15164v1,Position: Behavioural Assurance Cannot Verify the Safety Claims Governance Now Demands,"Pratinav Seth, Vinay Kumar Sankarapu",2026-05-14 17:54:28+00:00,2026-05-14 17:54:28+00:00,"This position paper argues that behavioural assurance, even when carefully designed, is being asked to carry safety claims it cannot verify. AI governance frameworks enacted between 2019 and early 2026 require reviewable evidence of properties such as the absence of hidden objectives, resistance to loss-of-control precursors, and bounded catastrophic capability; current assurance methodologies (primarily behavioural evaluations and red-teaming) are epistemically limited to observable model outputs and cannot verify the latent representations or long-horizon agentic behaviours these frameworks presume to regulate. We formalize this structural mismatch as the audit gap, the divergence between required and achievable verification access, and introduce the concept of fragile assurance to describe cases where the evidential structure does not support the asserted safety claim. Through an analysis of a 21-instrument inventory, we identify an incentive gradient where geopolitical and industrial pressures systematically reward surface-level behavioral proxies over deep structural verification. Finally, we propose a technical pivot: bounding the weight of behavioral evidence in legal text and extending voluntary pre-deployment access with mechanistic-evidence classes, specifically linear probes, activation patching, and before/after-training comparisons.","cs.LG, cs.AI",cs.LG,https://arxiv.org/pdf/2605.15164v1,http://arxiv.org/abs/2605.15164v1,,,,quantum machine learning,2605.15164v1.pdf
2605.15160v1,N-body next-to-leading order gravitational spin-orbit interaction via effective field theory,"Leonardo Wimmer, Hideyuki Tagoshi",2026-05-14 17:53:26+00:00,2026-05-14 17:53:26+00:00,"Using the post-Newtonian effective field theory (PN-EFT) formalism for spinning gravitating bodies, we derive the next-to-leading-order (NLO) spin-orbit potential and Hamiltonian for a system of N spinning bodies in general relativity. This extends the EFT treatment of the binary case to arbitrary N. We present two derivations: one in the generalized canonical gauge, and one based on the covariant spin supplementary condition (SSC), followed by a noncanonical transformation to canonical variables. In both approaches, the only new contributions beyond the binary case are three-body interaction diagrams. The canonical Hamiltonians obtained from the two EFT routes agree with the known ADM N-body Hamiltonian of Hartung and Steinhoff up to a canonical transformation.","gr-qc, hep-th",gr-qc,https://arxiv.org/pdf/2605.15160v1,http://arxiv.org/abs/2605.15160v1,,,,quantum machine learning,2605.15160v1.pdf
2605.15157v1,Hand-in-the-Loop: Improving Dexterous VLA via Seamless Interventional Correction,"Zhuohang Li, Liqun Huang, Wei Xu, Zhengming Zhu, Nie Lin, Xiao Ma, Xinjun Sheng, Ruoshi Wen",2026-05-14 17:51:40+00:00,2026-05-14 17:51:40+00:00,"Vision-Language-Action (VLA) models are prone to compounding errors in dexterous manipulation, where high-dimensional action spaces and contact-rich dynamics amplify small policy deviations over long horizons. While Interactive Imitation Learning (IIL) can refine policies through human takeover data, applying it to high-degree-of-freedom (DoF) robotic hands remains challenging due to a command mismatch between human teleoperation and policy execution at the takeover moment, which causes abrupt robot-hand configuration changes, or ""gesture jumps"". We present Hand-in-the-Loop (HandITL), a seamless human-in-the-loop intervention method that blends human corrective intent with autonomous policy execution to avoid gesture jumps during bimanual dexterous manipulation. Compared with direct teleoperation takeover, HandITL reduces takeover jitter by 99.8% and preserves robust post-takeover manipulation, reducing grasp failures by 87.5% and mean completion time by 19.1%. We validate HandITL on tasks requiring bimanual coordination, tool use, and fine-grained long-horizon manipulation. When used to collect intervention data for policy refinement, HandITL yields policies that outperform those trained with standard teleoperation data by 19% on average across three long-horizon dexterous tasks.","cs.RO, cs.LG",cs.RO,https://arxiv.org/pdf/2605.15157v1,http://arxiv.org/abs/2605.15157v1,,,,quantum machine learning,2605.15157v1.pdf
2605.15150v1,Extensive long-range magic in non-Abelian topological orders,"Yuzhen Zhang, Isaac H. Kim, Yimu Bao, Sagar Vijay",2026-05-14 17:50:20+00:00,2026-05-14 17:50:20+00:00,"We show that the low-energy states of non-Abelian topological orders possess extensive magic which is long-ranged, and cannot be eliminated by a constant-depth local unitary circuit. This refines conventional notions of complexity beyond the linear circuit depth which is required to prepare any topological phase, and provides a new resource-theoretic characterization of topological orders. A central technical result is a no-go theorem establishing that stabilizer states--even up to constant-depth local unitarie--cannot approximate low-energy states of non-Abelian string-net models which satisfy the entanglement bootstrap axioms. Moreover, we show that stabilizer-realizable Abelian string-net phases have mutual braiding phases quantized by the on-site qudit dimension, and that any violation of this condition necessarily implies extensive long-range magic. Extending to higher spatial dimensions, we argue that any state obeying an entanglement area law and hosting excitations with nontrivial fusion spaces must exhibit extensive long-range magic. This applies, in particular, to ground-states and low-energy states of higher-dimensional quantum double models.","quant-ph, cond-mat.str-el, cs.CC, hep-th",quant-ph,https://arxiv.org/pdf/2605.15150v1,http://arxiv.org/abs/2605.15150v1,51 pages,,,quantum neural network,2605.15150v1.pdf
2605.15142v1,Creating treatment and component hierarchies in component network meta-analysis,"Augustine Wigle, Audrey Béliveau, Adriani Nikolakopoulou, Lifeng Lin",2026-05-14 17:46:51+00:00,2026-05-14 17:46:51+00:00,"Component network meta-analysis (CNMA) is a statistical methodology that enables estimation of relative effects for multi-component treatments, such as combinations of antidepressants, and individual components, such as single antidepressants, by synthesizing data from multiple studies. A commonly desired output of a systematic review and meta-analysis is a hierarchy of the treatments in terms of a certain performance metric. Methods have been established for standard network meta-analysis (NMA), but have not yet been extended to CNMA. In particular, CNMA presents unique challenges because the set of relative effects that can be uniquely estimated is more complex to determine compared to standard NMA, and a hierarchy involving relative effects that are not uniquely estimable is misleading. We present a step-by-step workflow for answering treatment hierarchy questions in both frequentist and Bayesian CNMA, including explicitly identifying the uniquely estimable relative effects. We illustrate the workflow by posing multiple treatment hierarchy questions in two distinct networks, one concerning primary care of depression and one disconnected network investigating treatment for chronic lymphocytic leukemia.",stat.ME,stat.ME,https://arxiv.org/pdf/2605.15142v1,http://arxiv.org/abs/2605.15142v1,,,,quantum neural network,2605.15142v1.pdf
2605.15127v1,Understanding How International Students in the U.S. Are Using Conversational AI to Support Cross-Cultural Adaptation,"Laleh Nourian, Anisa Callis, Stephanie Patterson, Jadeline Miao, Jamison Heard, Garreth W. Tigwell",2026-05-14 17:37:23+00:00,2026-05-14 17:37:23+00:00,"Moving to a new culture and adapting to a new life, as an international student, can be a stressful experience. In the US, international students face unique overlapping challenges, yet the current support ecosystem, including university support systems and informal social networks, remains largely fragmented. While conversational AI has emerged as a tool used by many (e.g., generative AI chatbots like ChatGPT and Google Gemini), we do not have a clear understanding of how international students adopt and perceive these technologies as support tools. We conducted a survey study (n=60) to map the relationship between international students' challenges and AI adoption patterns, followed by an interview study with 14 participants to identify the underlying motivations and boundaries of use. Our findings show that AI is perceived as a first-aid tool for immediate challenges, however, there is an interest in transforming AI from a tool for short-term help into a long-term support companion. By identifying where and how AI can provide long-term support, and where it is insufficient, we contribute recommendations for creating AI-powered support tailored to the unique needs of international students.","cs.HC, cs.AI",cs.HC,https://arxiv.org/pdf/2605.15127v1,http://arxiv.org/abs/2605.15127v1,"33 pages, single column. 4 figures, 9 tables",,,quantum neural network,2605.15127v1.pdf
2605.15122v1,"CoCo-InEKF: State Estimation with Learned Contact Covariances in Dynamic, Contact-Rich Scenarios","Michael Baumgartner, David Müller, Agon Serifi, Ruben Grandia, Espen Knoop, Markus Gross, Moritz Bächer",2026-05-14 17:35:06+00:00,2026-05-14 17:35:06+00:00,"Robust state estimation for highly dynamic motion of legged robots remains challenging, especially in dynamic, contact-rich scenarios. Traditional approaches often rely on binary contact states that fail to capture the nuances of partial contact or directional slippage. This paper presents CoCo-InEKF, a differentiable invariant extended Kalman filter that utilizes continuous contact velocity covariances instead of binary contact states. These learned covariances allow the method to dynamically modulate contact confidence, accounting for more nuanced conditions ranging from firm contact to directional slippage or no contact. To predict these covariances for a set of predefined contact candidate points, we employ a lightweight neural network trained end-to-end using a state-error loss. This approach eliminates the need for heuristic ground-truth contact labels. In addition, we propose an automated contact candidate selection procedure and demonstrate that our method is insensitive to their exact placement. Experiments on a bipedal robot demonstrate a superior accuracy-efficiency tradeoff for linear velocity estimation, as well as improved filter consistency compared to baseline methods. This enables the robust execution of challenging motions, including dancing and complex ground interactions -- both in simulation and in the real world.","cs.RO, cs.LG, eess.SY",cs.RO,https://arxiv.org/pdf/2605.15122v1,http://arxiv.org/abs/2605.15122v1,RSS 2026,,,quantum neural network,2605.15122v1.pdf
2605.15121v1,Rovibrational structure and electric dipole moments of the AcOCH$_3$+ ion,Anna Zakharova,2026-05-14 17:32:42+00:00,2026-05-14 17:32:42+00:00,"The possibility of laser cooling and the presence of closely spaced rovibrational doublets make polyatomic molecules an attractive platform for the $\mathcal{P}$, $\mathcal{T}$-violation searches. We study the spectrum of the lowest rovibrational state of the AcOCH$_3+$ symmetric top molecule. The electronic structure full-electron computation was performed within a relativistic coupled cluster method with double and perturbative triple excitations. The rovibrational wavefunctions are obtained using a coupled channel technique, taking into account all rovibrational effects and anharmonicities of the potential. As a result, the vibrational frequencies, as well as the values of the electric dipole moments for the rovibrational states, were computed.","physics.atom-ph, hep-ph, physics.chem-ph, quant-ph",physics.atom-ph,https://arxiv.org/pdf/2605.15121v1,http://arxiv.org/abs/2605.15121v1,"11 pages, 4 figures",,,quantum neural network,2605.15121v1.pdf
2605.15119v1,Identification and Estimation of Staggered Difference-in-Differences with Network Spillovers,Hayato Tagawa,2026-05-14 17:31:33+00:00,2026-05-14 17:31:33+00:00,"This paper develops a difference-in-differences framework for staggered policy adoption when units can be affected by other units' adoption. For each treated cohort and event time, the framework separates the effect of own adoption, the spillover effect generated by other adopters, and the total effect under the realized rollout. Identification uses a prespecified summary of spillover exposure and parallel trends comparisons among units with the same exposure at the baseline and target dates. Spillover effects are learned from never-treated units and evaluated for treated cohorts under the exposure distribution they face. We construct estimators for these effects and an inference procedure that allows for spatial dependence. Monte Carlo simulations illustrate that standard DID estimators that ignore spillovers can miss the total effect, whereas the proposed estimators have small bias for these effects and the associated confidence intervals have coverage close to the nominal level. In an empirical study of the Community Health Centers rollout, estimated spillovers account for a substantial share of the effect on older-adult mortality.",econ.EM,econ.EM,https://arxiv.org/pdf/2605.15119v1,http://arxiv.org/abs/2605.15119v1,,,,quantum neural network,2605.15119v1.pdf
2605.15114v1,New approaches to almost i.i.d. information theory,"Filippo Girardi, Giacomo De Palma, Ludovico Lami",2026-05-14 17:27:47+00:00,2026-05-14 17:27:47+00:00,"Independent and identically distributed (i.i.d.) states are ubiquitous in quantum information theory. However, in a practical setting, the i.i.d. assumption is too stringent, and possibly not realistic. A physically more compelling class of 'almost i.i.d.' sources was recently proposed by [Mazzola/Sutter/Renner, arXiv:2603.15792]. In this paper, we introduce two alternative definitions of almost i.i.d. states, based on the normalised quantum Wasserstein distance and on the idea of looking at the average $k$-body marginal. We explore some basic properties of these notions and prove a strict hierarchical relation among them, with Mazzola et al.'s notion being the strictest, the one based on $k$-body marginals the loosest, and the one based on the quantum Wasserstein distance in between. Strict separation is established by means of explicit examples.","quant-ph, math-ph",quant-ph,https://arxiv.org/pdf/2605.15114v1,http://arxiv.org/abs/2605.15114v1,"22 pages, 1 figure",,,quantum neural network,2605.15114v1.pdf
2605.15106v1,Scalable self-testing of generic multipartite quantum states,"Jinchang Liu, Elias X. Huber, Zhenyu Du, Xingjian Zhang, Xiongfeng Ma",2026-05-14 17:23:40+00:00,2026-05-14 17:23:40+00:00,"Characterizing large quantum systems with minimal assumptions is a central challenge in quantum information science. Self-testing provides the strongest form of certification by identifying the underlying quantum state solely from observed measurement statistics. However, existing self-testing methods for generic $n$-partite states face a scalability barrier, requiring exponentially many samples in the system size. In this work, we overcome this barrier by introducing a protocol that robustly self-tests almost all $n$-qubit states with only polynomial sample complexity. The key ingredient is an efficient scheme for device-independently evaluating multipartite Pauli measurements, which can be implemented using only a linear number of ancillary Bell pairs together with standard projective and Bell measurements, well within the reach of current quantum technology. Beyond self-testing states, our scheme provides a general framework for implementing a wide range of learning and certification protocols in the device-independent setting, thereby opening a scalable route to device-independent quantum information processing in large-scale quantum networks.",quant-ph,quant-ph,https://arxiv.org/pdf/2605.15106v1,http://arxiv.org/abs/2605.15106v1,"47 pages, 5 figures, comments are welcome!",,,quantum neural network,2605.15106v1.pdf
2605.15103v1,"Investigating the Suitability of Delay Tolerant Networks for Broadcasting Tsunami Warnings in Palu, Indonesia","Adam Graham, Milena Radenkovic",2026-05-14 17:21:20+00:00,2026-05-14 17:21:20+00:00,"On the 28th of September, 2018, a tsunami hit the city of Palu in Indonesia, killing 4,340 people. The earthquake preceding the tsunami crippled communication lines and may have rendered the transmission of tsunami warning messages using traditional end-to-end approaches impossible. This paper proposes an alternative approach using Delay Tolerant Networks (DTNs) for tsunami warning message routing given their resilience to disruptions and sparse connections. Both Epidemic and Spray and Wait routing protocols were simulated in a pseudo-realistic environment to evaluate their effectiveness for transmitting tsunami warning messages in Palu. Results indicated that these protocols are not suitable for the tight time constraints of post-earthquake tsunami warnings with the currently available technology. However, they may have promising applications for the earthquakes that precede tsunamis.",cs.NI,cs.NI,https://arxiv.org/pdf/2605.15103v1,http://arxiv.org/abs/2605.15103v1,,,,quantum neural network,2605.15103v1.pdf
2605.15193v1,Aligning Latent Geometry for Spherical Flow Matching in Image Generation,"Tuna Han Salih Meral, Kaan Oktay, Hidir Yesiltepe, Adil Kaan Akan, Pinar Yanardag",2026-05-14 17:59:37+00:00,2026-05-14 17:59:37+00:00,"Latent flow matching for image generation usually transports Gaussian noise to variational autoencoder latents along linear paths. Both endpoints, however, concentrate in thin spherical shells, and a Euclidean chord leaves those shells even when preprocessing aligns their radii. By decomposing each latent token into radial and angular components, we show through component-swap probes that decoded perceptual and semantic content is carried predominantly by direction, with radius contributing much less. We therefore project data latents onto a fixed token radius, use the radial projection of Gaussian noise as the spherical prior, finetune the decoder with the encoder frozen, and replace linear interpolation with spherical linear interpolation. The resulting geodesic paths stay on the sphere at every timestep, and their velocity targets are purely angular by construction. Under matched training, the method consistently improves class-conditional ImageNet-256 FID across different image tokenizers, leaves the diffusion architecture unchanged, and requires no auxiliary encoder or representation-alignment objective.",cs.CV,cs.CV,https://arxiv.org/pdf/2605.15193v1,http://arxiv.org/abs/2605.15193v1,,,,variational quantum circuit,2605.15193v1.pdf
2605.15163v1,Automating Bitvector and Finite Field Equivalence Proofs in Lean,"Elizaveta Pertseva, Valentin Robert, Clark Barrett, James Parker",2026-05-14 17:54:04+00:00,2026-05-14 17:54:04+00:00,"Efforts to verify Zero-Knowledge Proof circuit encodings have highlighted the challenge of proving the correctness of quantifier-free statements that make use of both bitvector and finite field operations. Existing verification workflows are either manual or rely on SMT solvers, which scale poorly on some classes of problems for reasons that include difficulties with conversion operators and challenges reasoning about inequalities. To address these limitations, we present a novel Lean tactic BitModEq that leverages range lemmas and case analysis to produce verified translations from finite fields to bitvectors. Our approach, combined with bit-blasting, outperforms state-of-the-art SMT solvers, solving 19% more ZKP arithmetization benchmarks.",cs.LO,cs.LO,https://arxiv.org/pdf/2605.15163v1,http://arxiv.org/abs/2605.15163v1,,,,variational quantum circuit,2605.15163v1.pdf
2605.15154v1,RoSHAP: A Distributional Framework and Robust Metric for Stable Feature Attribution,"Lanxin Xiang, Liang Shi, Youhui Ye, Boyu Jiang, Dawei Zhou, Feng Guo",2026-05-14 17:51:09+00:00,2026-05-14 17:51:09+00:00,"Feature attribution analysis is critical for interpreting machine learning models and supporting reliable data-driven decisions. However, feature attribution measures often exhibit stochastic variation: different train--test splits, random seeds, or model-fitting procedures can produce substantially different attribution values and feature rankings. This paper proposes a framework for incorporating stochastic nature of feature attribution and a robust attribution metric, RoSHAP, for stable feature ranking based on the SHAP metric. The proposed framework models the distribution of feature attribution scores and estimates it through bootstrap resampling and kernel density estimation. We show that, under mild regularity conditions, the aggregated feature attribution score is asymptotically Gaussian, which greatly reduces the computational cost of distribution estimation. The RoSHAP summarizes the distribution of SHAP into a robust feature-ranking criterion that simultaneously rewards features that are active, strong, and stable. Through simulations and real-data experiments, the proposed framework and RoSHAP outperform standard single-run attribution measures in identifying signal features. In addition, models built using RoSHAP-selected features achieve predictive performance comparable to full-feature models while using substantially fewer predictors. The proposed RoSHAP approach improves the stability and interpretability of machine learning models, enabling reliable and consistent insights for analysis.","stat.ML, cs.LG",stat.ML,https://arxiv.org/pdf/2605.15154v1,http://arxiv.org/abs/2605.15154v1,,,,variational quantum circuit,2605.15154v1.pdf
2605.15148v1,Noether symmetries and conservation laws of a class of time-dependent multidimensional nonlinear wave equations,"F. Güngör, C. Özemir",2026-05-14 17:49:47+00:00,2026-05-14 17:49:47+00:00,"Conservation laws of a class of time-dependent damped nonlinear multidimensional wave equations are derived by Noether's theorem. For arbitrary nonzero damping coefficient and nonlinear interaction term, its infinitesimal variational symmetries span a Euclidean algebra $\euclid(n)$ of space translations and rotations. They produce conservation of linear and angular momentums. For some specific forms of these two terms symmetry algebra is enlarged to a subalgebra of the conformal algebra $\conf(1,n)$ and in this case more interesting conservation laws are found.","math-ph, math.AP",math-ph,https://arxiv.org/pdf/2605.15148v1,http://arxiv.org/abs/2605.15148v1,9 pages,,,variational quantum circuit,2605.15148v1.pdf
2605.15138v1,Forgetting That Sticks: Quantization-Permanent Unlearning via Circuit Attribution,"Saisab Sadhu, Pratinav Seth, Vinay Kumar Sankarapu",2026-05-14 17:44:10+00:00,2026-05-14 17:44:10+00:00,"Standard unlearning evaluations measure behavioral suppression in full precision, immediately after training, despite every deployed language model being quantized first. Recent work has shown that 4-bit post-training quantization can reverse machine unlearning; we show this is not a tuning artefact but a systematic dual failure: gradient-based methods that achieve meaningful forgetting lose it under compression, while methods that survive quantization barely change the model. Both failures trace to the same root cause: across all baselines, per-parameter updates lie 47-828x below the NF4 quantization bin width; updates diffused across billions of parameters cannot clear quantization bin boundaries, a consequence we formalize as a sparsity-permanence tradeoff. We present MANSU (Mechanistic-Aligned Null-Space Unlearning), which resolves both modes by combining causal circuit attribution to isolate the minimal forget-set subgraph, circuit-restricted null-space projection with a diagonal-Fisher retain bound, and a per-parameter magnitude floor guaranteeing quantization survival by construction. We additionally introduce Circuit Attribution Divergence (CAD), a mechanistic verification metric distinguishing structural erasure from behavioral suppression, a distinction existing metrics cannot make. Across multiple model families and hazard benchmarks, MANSU is the first method to jointly satisfy all four properties with margin on each (meaningful forgetting, retain preservation, non-positive PTQ gap, and structural erasure), while gradient-based baselines recover up to +0.05 accuracy under compression.","cs.LG, cs.CL, cs.ET",cs.LG,https://arxiv.org/pdf/2605.15138v1,http://arxiv.org/abs/2605.15138v1,,,,variational quantum circuit,2605.15138v1.pdf
